{
  "format": "QSHIELD-P4-VECTOR-SET-1",
  "schema_version": "1.0.0",
  "generated_at": "2025-12-31T00:00:00Z",
  "source": {
    "phase": "suite2",
    "artifact_id": "suite2-vectors",
    "member": "inputs/suite2/vectors/qshield_suite2_mk_hybrid_vectors_v1.json",
    "format": "json",
    "version": "1.0.0"
  },
  "protocol": {
    "protocol_version": "0x0500",
    "suite_id": "0x0002",
    "suite_name": "QSP-SUITE-2"
  },
  "registries": {
    "reason_codes": [
      {
        "code": "REJECT_S2_MK_MISMATCH",
        "description": "Derived mk sequence did not match expected (CAT-S2-MK-001 conformance op).",
        "spec_ref": "DOC-TST-005 CAT-S2-MK-001"
      }
    ]
  },
  "vectors": [
    {
      "id": "S2-MK-ACCEPT-0001",
      "op": "suite2.mk_hybrid.check",
      "kind": "positive",
      "tags": [
        "CAT-S2-MK-001",
        "G1"
      ],
      "spec_refs": [
        "DOC-CAN-003 §3.3.1",
        "DOC-CAN-003 §3.3.4",
        "DOC-CAN-003 §3.3.5",
        "DOC-CAN-003 §7.3"
      ],
      "input": {
        "CK_ec": { "type": "hex", "data": "000102030405060708090a0b0c0d0e0f101112131415161718191a1b1c1d1e1f" },
        "CK_pq": { "type": "hex", "data": "202122232425262728292a2b2c2d2e2f303132333435363738393a3b3c3d3e3f" },
        "count": { "type": "json", "data": { "u32": 3 } }
      },
      "expect": {
        "ok": true,
        "output": {
          "mk_list": {
            "type": "json",
            "data": [
              { "type": "hex", "data": "9803eca7c9240bf30cbb15daba024bd764faa83f3dcd3e3c4cf480b9d637ddd2" },
              { "type": "hex", "data": "f66309db249f0821bc67f066aa1298146e752d5e3c1d113f31f522a63b2fc04d" },
              { "type": "hex", "data": "e7a26bc1e55e33860ed0d0ad9aaaf7f82ee2e587c9d53ffd822e41b6172fc5de" }
            ]
          },
          "CK_ec_final": { "type": "hex", "data": "12bb2d452d1535079f29627ec92d58d0336c0a9bf706f4bd59894c14fbf5aaed" },
          "CK_pq_final": { "type": "hex", "data": "69cf9cb110a60fc5d045cf4ccb9faa8ca30e513ef405321d0b5018b42dfbecaa" }
        }
      }
    },
    {
      "id": "S2-MK-REJECT-CK-EC-0001",
      "op": "suite2.mk_hybrid.check",
      "kind": "negative",
      "tags": [
        "CAT-S2-MK-001",
        "G1"
      ],
      "spec_refs": [
        "DOC-CAN-003 §3.3.1",
        "DOC-CAN-003 §3.3.4",
        "DOC-CAN-003 §3.3.5"
      ],
      "input": {
        "CK_ec": { "type": "hex", "data": "000102030405060708090a0b0c0d0e0f101112131415161718191a1b1c1d1e1e" },
        "CK_pq": { "type": "hex", "data": "202122232425262728292a2b2c2d2e2f303132333435363738393a3b3c3d3e3f" },
        "count": { "type": "json", "data": { "u32": 3 } },
        "expected_mk_list": {
          "type": "json",
          "data": [
            { "type": "hex", "data": "9803eca7c9240bf30cbb15daba024bd764faa83f3dcd3e3c4cf480b9d637ddd2" },
            { "type": "hex", "data": "f66309db249f0821bc67f066aa1298146e752d5e3c1d113f31f522a63b2fc04d" },
            { "type": "hex", "data": "e7a26bc1e55e33860ed0d0ad9aaaf7f82ee2e587c9d53ffd822e41b6172fc5de" }
          ]
        }
      },
      "expect": {
        "ok": false,
        "reason_code": "REJECT_S2_MK_MISMATCH"
      }
    },
    {
      "id": "S2-MK-REJECT-CK-PQ-0001",
      "op": "suite2.mk_hybrid.check",
      "kind": "negative",
      "tags": [
        "CAT-S2-MK-001",
        "G1"
      ],
      "spec_refs": [
        "DOC-CAN-003 §3.3.1",
        "DOC-CAN-003 §3.3.4",
        "DOC-CAN-003 §3.3.5"
      ],
      "input": {
        "CK_ec": { "type": "hex", "data": "000102030405060708090a0b0c0d0e0f101112131415161718191a1b1c1d1e1f" },
        "CK_pq": { "type": "hex", "data": "202122232425262728292a2b2c2d2e2f303132333435363738393a3b3c3d3e3e" },
        "count": { "type": "json", "data": { "u32": 3 } },
        "expected_mk_list": {
          "type": "json",
          "data": [
            { "type": "hex", "data": "9803eca7c9240bf30cbb15daba024bd764faa83f3dcd3e3c4cf480b9d637ddd2" },
            { "type": "hex", "data": "f66309db249f0821bc67f066aa1298146e752d5e3c1d113f31f522a63b2fc04d" },
            { "type": "hex", "data": "e7a26bc1e55e33860ed0d0ad9aaaf7f82ee2e587c9d53ffd822e41b6172fc5de" }
          ]
        }
      },
      "expect": {
        "ok": false,
        "reason_code": "REJECT_S2_MK_MISMATCH"
      }
    }
  ]
}
